{
  "$schema": "https://json-schema.org/draft/2020-12/schema",
  "title": "Vector AGNC Shotlist Data",
  "type": "object",
  "additionalProperties": false,
  "required": [
    "CLIENTE",
    "FECHA",
    "RESUMEN_CORTO",
    "LOCACION",
    "HORA_INICIO",
    "PRIORIDAD_VISUAL",
    "SI_DECIR_01",
    "SI_DECIR_02",
    "SI_DECIR_03",
    "SI_DECIR_04",
    "NO_DECIR_01",
    "NO_DECIR_02",
    "NO_DECIR_03",
    "NO_DECIR_04",
    "INTRO_01_TITULO",
    "INTRO_01",
    "INTRO_02_TITULO",
    "INTRO_02",
    "INTRO_03_TITULO",
    "INTRO_03",
    "INTRO_04_TITULO",
    "INTRO_04",
    "BENEFICIO_01_TITULO",
    "BENEFICIO_01",
    "BENEFICIO_02_TITULO",
    "BENEFICIO_02",
    "BENEFICIO_03_TITULO",
    "BENEFICIO_03",
    "BENEFICIO_04_TITULO",
    "BENEFICIO_04",
    "CTA_01_TITULO",
    "CTA_01",
    "CTA_02_TITULO",
    "CTA_02",
    "CTA_03_TITULO",
    "CTA_03",
    "CTA_04_TITULO",
    "CTA_04",
    "BROLL_PRODUCTO",
    "BROLL_USO_PROCESO",
    "BROLL_DETALLE",
    "BROLL_CONTEXTO",
    "BROLL_CIERRE",
    "QUOTE_TEXT",
    "QUOTE_SOURCE"
  ],
  "properties": {
    "CLIENTE": { "type": "string", "minLength": 1 },
    "FECHA": { "type": "string", "minLength": 1 },
    "RESUMEN_CORTO": { "type": "string", "minLength": 1 },
    "LOCACION": { "type": "string", "minLength": 1 },
    "HORA_INICIO": { "type": "string", "minLength": 1 },
    "PRIORIDAD_VISUAL": { "type": "string", "minLength": 1 },
    "SI_DECIR_01": { "type": "string", "minLength": 1 },
    "SI_DECIR_02": { "type": "string", "minLength": 1 },
    "SI_DECIR_03": { "type": "string", "minLength": 1 },
    "SI_DECIR_04": { "type": "string", "minLength": 1 },
    "NO_DECIR_01": { "type": "string", "minLength": 1 },
    "NO_DECIR_02": { "type": "string", "minLength": 1 },
    "NO_DECIR_03": { "type": "string", "minLength": 1 },
    "NO_DECIR_04": { "type": "string", "minLength": 1 },
    "INTRO_01_TITULO": { "type": "string", "minLength": 1 },
    "INTRO_01": { "type": "string", "minLength": 1 },
    "INTRO_02_TITULO": { "type": "string", "minLength": 1 },
    "INTRO_02": { "type": "string", "minLength": 1 },
    "INTRO_03_TITULO": { "type": "string", "minLength": 1 },
    "INTRO_03": { "type": "string", "minLength": 1 },
    "INTRO_04_TITULO": { "type": "string", "minLength": 1 },
    "INTRO_04": { "type": "string", "minLength": 1 },
    "BENEFICIO_01_TITULO": { "type": "string", "minLength": 1 },
    "BENEFICIO_01": { "type": "string", "minLength": 1 },
    "BENEFICIO_02_TITULO": { "type": "string", "minLength": 1 },
    "BENEFICIO_02": { "type": "string", "minLength": 1 },
    "BENEFICIO_03_TITULO": { "type": "string", "minLength": 1 },
    "BENEFICIO_03": { "type": "string", "minLength": 1 },
    "BENEFICIO_04_TITULO": { "type": "string", "minLength": 1 },
    "BENEFICIO_04": { "type": "string", "minLength": 1 },
    "CTA_01_TITULO": { "type": "string", "minLength": 1 },
    "CTA_01": { "type": "string", "minLength": 1 },
    "CTA_02_TITULO": { "type": "string", "minLength": 1 },
    "CTA_02": { "type": "string", "minLength": 1 },
    "CTA_03_TITULO": { "type": "string", "minLength": 1 },
    "CTA_03": { "type": "string", "minLength": 1 },
    "CTA_04_TITULO": { "type": "string", "minLength": 1 },
    "CTA_04": { "type": "string", "minLength": 1 },
    "BROLL_PRODUCTO": { "type": "string", "minLength": 1 },
    "BROLL_USO_PROCESO": { "type": "string", "minLength": 1 },
    "BROLL_DETALLE": { "type": "string", "minLength": 1 },
    "BROLL_CONTEXTO": { "type": "string", "minLength": 1 },
    "BROLL_CIERRE": { "type": "string", "minLength": 1 },
    "QUOTE_TEXT": { "type": "string", "minLength": 1 },
    "QUOTE_SOURCE": { "type": "string", "minLength": 1 }
  }
}
