{
  "CLIENTE": "Detail Sport",
  "FECHA": "05/20/2026",
  "RESUMEN_CORTO": "Shotlist interno para grabar una pieza sobre instalación de PPF en un Ferrari 812, enfocada en proceso profesional, cuidado de pintura y detalles visuales sin prometer resultados garantizados.",
  "LOCACION": "Detail Sport Studio",
  "HORA_INICIO": "09:00",
  "PRIORIDAD_VISUAL": "Mostrar preparación, precisión manual, textura del material, bordes, terminaciones y presencia del vehículo sin caer en claims absolutos.",
  "SI_DECIR_01": "El PPF ayuda a proteger la pintura contra desgaste visual del uso diario.",
  "SI_DECIR_02": "El proceso requiere preparación, cuidado de superficie e instalación profesional.",
  "SI_DECIR_03": "Cada panel se trabaja con atención al detalle.",
  "SI_DECIR_04": "La instalación permite mostrar un proceso técnico y visualmente limpio.",
  "NO_DECIR_01": "No decir que el resultado está garantizado.",
  "NO_DECIR_02": "No decir que el auto queda como nuevo.",
  "NO_DECIR_03": "No decir que somos los mejores del mercado.",
  "NO_DECIR_04": "No decir que la protección es permanente o eterna.",
  "INTRO_01_TITULO": "Llegada del vehículo",
  "INTRO_01": "Hoy vamos a documentar el proceso de protección de pintura en este Ferrari 812.",
  "INTRO_02_TITULO": "Contexto del trabajo",
  "INTRO_02": "Antes de instalar, revisamos superficie, zonas críticas y flujo de trabajo.",
  "INTRO_03_TITULO": "Enfoque técnico",
  "INTRO_03": "La pieza debe mostrar preparación, precisión y cuidado en cada panel.",
  "INTRO_04_TITULO": "Promesa visual",
  "INTRO_04": "El objetivo es que el espectador entienda el proceso sin exagerar resultados.",
  "BENEFICIO_01_TITULO": "Protección visual",
  "BENEFICIO_01": "El PPF ayuda a reducir desgaste visual provocado por el uso diario.",
  "BENEFICIO_02_TITULO": "Proceso profesional",
  "BENEFICIO_02": "Una instalación cuidada depende de preparación, técnica y control de detalles.",
  "BENEFICIO_03_TITULO": "Detalle de superficie",
  "BENEFICIO_03": "Los planos cerrados deben mostrar textura, alineación y terminaciones.",
  "BENEFICIO_04_TITULO": "Confianza sin exagerar",
  "BENEFICIO_04": "La comunicación debe sonar profesional, clara y responsable.",
  "CTA_01_TITULO": "Evaluación",
  "CTA_01": "Agende una evaluación de protección para su vehículo.",
  "CTA_02_TITULO": "Consulta",
  "CTA_02": "Consulte qué zonas de su vehículo podrían beneficiarse de una protección profesional.",
  "CTA_03_TITULO": "Proceso",
  "CTA_03": "Conozca cómo se prepara cada pieza antes de la instalación.",
  "CTA_04_TITULO": "Cierre seguro",
  "CTA_04": "Si quiere cuidar la pintura de su vehículo, conversemos sobre la opción adecuada.",
  "BROLL_PRODUCTO": "Plano general del Ferrari 812 al llegar al estudio.",
  "BROLL_USO_PROCESO": "Preparación de superficie, limpieza, medición y aplicación inicial.",
  "BROLL_DETALLE": "Manos instalando película, bordes, curvas, textura y terminaciones.",
  "BROLL_CONTEXTO": "Herramientas, iluminación del estudio, movimiento alrededor del vehículo y ambiente de trabajo.",
  "BROLL_CIERRE": "Plano final del vehículo terminado, sin prometer resultado garantizado.",
  "QUOTE_TEXT": "The essence of cinema is editing.",
  "QUOTE_SOURCE": "Francis Ford Coppola"
}
